{
  "schemaVersion": 3,
  "judgmentKind": "primary",
  "problemId": "no-three-in-line-77",
  "ledgerHead": "be5cadd97b2cd4b5916c5cda87838c5e132ec5a2",
  "problemLedgerDigest": "sha256:7f1b880efd5b9e0d043ddabad88a31b5a25beed435108a6505a337c0b96b00e3",
  "judgeSpec": {
    "id": "openrouter-validity-judgment-v3",
    "digest": "sha256:cf5263db9eafaccb98bca221a921209e8b76ca3c63c410f409bca2751719adf7"
  },
  "subjects": [
    {
      "kind": "transaction",
      "id": "3baf1c8586af31bbd6509d0fd3e552658c03673b",
      "ledgerPosition": 6
    }
  ],
  "assessments": [
    {
      "claimKey": "no-three-in-line-77/record-152-eight-embedding-local-rigidity",
      "status": "indeterminate",
      "premiseStatus": "missing",
      "summary": "The mathematical reduction and checker logic appear appropriate, and the stated consequences for nearby no-three-in-line sets follow conditionally from the claimed blocking census. However, the record supplies no trusted execution attestation or exhaustive certificate establishing that the checker successfully ran on the exact referenced configuration bytes and produced the asserted results. The committed results file alone does not certify all per-cell blocking computations. Thus the claim is not affirmatively established, although no decisive mathematical error was found.",
      "scopeQualifications": [
        "The claim is limited to the eight embeddings derived from the referenced 152-point configuration, not other 152-point configurations or the global value of D(77).",
        "The local-rigidity conclusions are valid only conditional on successful exhaustive verification of the asserted blocking and deletion census."
      ],
      "evidenceIssues": [
        "The exact configuration coordinates are not included in the subject and must be obtained from the declared reference.",
        "No terminal objective attestation or trusted execution transcript confirms successful verification on the supplied bytes.",
        "The asserted results file omits the exhaustive per-cell line censuses and cannot independently establish saturation or exhaustiveness.",
        "Neither the dependency verifier nor the rigidity checker is attested as having run successfully."
      ],
      "evidenceTransactionIds": [
        "dfc0cc40d41105292a119840dcdbe6f22860cf43"
      ],
      "requiredDependencyTransactionIds": [
        "dfc0cc40d41105292a119840dcdbe6f22860cf43"
      ]
    }
  ],
  "findings": [
    {
      "claimKey": "no-three-in-line-77/record-152-eight-embedding-local-rigidity",
      "stance": "uncertain",
      "summary": "The mathematical reduction and checker logic appear appropriate, and the stated consequences for nearby no-three-in-line sets follow conditionally from the claimed blocking census. However, the record supplies no trusted execution attestation or exhaustive certificate establishing that the checker successfully ran on the exact referenced configuration bytes and produced the asserted results. The committed results file alone does not certify all per-cell blocking computations. Thus the claim is not affirmatively established, although no decisive mathematical error was found.",
      "subjectTransactionIds": [
        "3baf1c8586af31bbd6509d0fd3e552658c03673b"
      ],
      "evidenceTransactionIds": [
        "dfc0cc40d41105292a119840dcdbe6f22860cf43"
      ]
    }
  ],
  "dependencyPacketDigest": "sha256:ca09a5644e10ebd161e9b8247d5e489e897ca426dc79fdfcc6691a857822e55f",
  "reportDigest": "sha256:b26ea099b29e7df9a014ff5e7f0d5a2f7bb86452483cda50a24c7ae15b8b5eac",
  "judgmentId": "sha256:b3009111acaf420b7ed2de592318b47a7c31b53988ff00d37f41db6f94dc3104"
}
