{
  "schemaVersion": 3,
  "judgmentKind": "primary",
  "problemId": "bssc-sum-capacity",
  "ledgerHead": "e2bbc1e210e496b3c834e658820fc90287f3b2c0",
  "problemLedgerDigest": "sha256:64c2f6f0acdedf371111078cee128a03b30f5782a07025da4ff4e9c908ab4220",
  "judgeSpec": {
    "id": "openrouter-validity-judgment-v3",
    "digest": "sha256:cf5263db9eafaccb98bca221a921209e8b76ca3c63c410f409bca2751719adf7"
  },
  "subjects": [
    {
      "kind": "transaction",
      "id": "e2bbc1e210e496b3c834e658820fc90287f3b2c0",
      "ledgerPosition": 11
    }
  ],
  "assessments": [
    {
      "claimKey": "bssc-sum-capacity/finite-grid-q0-foundations",
      "status": "valid",
      "premiseStatus": "satisfied",
      "summary": "The supplied argument establishes the finite-grid cardinality reductions by posterior representation and Carathéodory compression, proves the reflection-compatible reduction, derives the exact Q0 parameterization, verifies the coercive bound B(G,K) >= V_0(g,k) >= max{F(g),F(k)}, obtains both Q0 infima equal to c, and derives the stated midpoint window. The required 30-row definitions, optimization order, and comparison V_Q(G,K) <= B(G,K) are supplied by the declared dependency.",
      "scopeQualifications": [
        "Validity is relative to the exact accepted private-message 30-row system supplied by the dependency.",
        "The result applies to finite posterior grids and finite-output receivers only.",
        "No continuum receiver-cardinality bound or grid-limit interchange is established.",
        "No full-functional reflected-optimality or symmetrization assertion for arbitrary receiver pairs is established.",
        "No new numerical sum-capacity bound or independent capacity-converse interpretation is established."
      ],
      "evidenceIssues": [],
      "evidenceTransactionIds": [
        "e3c1036ca607539a5ebcddf3058e6014ac5c1cd9"
      ],
      "requiredDependencyTransactionIds": [
        "e3c1036ca607539a5ebcddf3058e6014ac5c1cd9"
      ]
    }
  ],
  "findings": [
    {
      "claimKey": "bssc-sum-capacity/finite-grid-q0-foundations",
      "stance": "supports",
      "summary": "The supplied argument establishes the finite-grid cardinality reductions by posterior representation and Carathéodory compression, proves the reflection-compatible reduction, derives the exact Q0 parameterization, verifies the coercive bound B(G,K) >= V_0(g,k) >= max{F(g),F(k)}, obtains both Q0 infima equal to c, and derives the stated midpoint window. The required 30-row definitions, optimization order, and comparison V_Q(G,K) <= B(G,K) are supplied by the declared dependency.",
      "subjectTransactionIds": [
        "e2bbc1e210e496b3c834e658820fc90287f3b2c0"
      ],
      "evidenceTransactionIds": [
        "e3c1036ca607539a5ebcddf3058e6014ac5c1cd9"
      ]
    }
  ],
  "dependencyPacketDigest": "sha256:3fb395fca8f60d56eeb559170bcfbf07d3dfb92c764de07c9ce37ed48b7925b0",
  "reportDigest": "sha256:936223bba5a4ff1b7b73aed6b9c8d94d5349f6a2a822344190f923c6b127f988",
  "judgmentId": "sha256:b4a7d18dcaed8c8bfa9a81a5057873f0ad3f0bd207cb57364e1aca0c8e85f7de"
}
