{
  "schemaVersion": 3,
  "judgmentKind": "primary",
  "problemId": "no-three-in-line-77",
  "ledgerHead": "be5cadd97b2cd4b5916c5cda87838c5e132ec5a2",
  "problemLedgerDigest": "sha256:7f1b880efd5b9e0d043ddabad88a31b5a25beed435108a6505a337c0b96b00e3",
  "judgeSpec": {
    "id": "openrouter-validity-judgment-v3",
    "digest": "sha256:cf5263db9eafaccb98bca221a921209e8b76ca3c63c410f409bca2751719adf7"
  },
  "subjects": [
    {
      "kind": "transaction",
      "id": "87f78eb20d47a1db7d4ef35702bf00b4af94ad8d",
      "ledgerPosition": 9
    }
  ],
  "assessments": [
    {
      "claimKey": "no-three-in-line-77/rct4-154-subclass-encoding-theorem",
      "status": "valid",
      "premiseStatus": "not-required",
      "summary": "The argument establishes a bijective, sound, and complete pseudo-Boolean encoding of 154-point no-three-in-line sets in the defined rct4 subclass. Off-diagonal eligible cells decompose into disjoint four-cell rho-orbits, the eligible main-diagonal cells into 38 antipodal pairs, and the exact-selection constraints yield 38·4+2=154 cells. For each maximal lattice line, the weighted sum equals the number of selected cells on that line, so the inequalities are equivalent to the no-three-in-line condition. No external dependency is required.",
      "scopeQualifications": [
        "The result applies only to the explicitly defined rct4 subclass of G_77.",
        "It makes no assertion about implementation-specific constraint counts or digests, satisfiability or infeasibility, larger symmetry classes, classification of rotations, or the value of D(77)."
      ],
      "evidenceIssues": [],
      "evidenceTransactionIds": [],
      "requiredDependencyTransactionIds": []
    }
  ],
  "findings": [
    {
      "claimKey": "no-three-in-line-77/rct4-154-subclass-encoding-theorem",
      "stance": "supports",
      "summary": "The argument establishes a bijective, sound, and complete pseudo-Boolean encoding of 154-point no-three-in-line sets in the defined rct4 subclass. Off-diagonal eligible cells decompose into disjoint four-cell rho-orbits, the eligible main-diagonal cells into 38 antipodal pairs, and the exact-selection constraints yield 38·4+2=154 cells. For each maximal lattice line, the weighted sum equals the number of selected cells on that line, so the inequalities are equivalent to the no-three-in-line condition. No external dependency is required.",
      "subjectTransactionIds": [
        "87f78eb20d47a1db7d4ef35702bf00b4af94ad8d"
      ],
      "evidenceTransactionIds": []
    }
  ],
  "dependencyPacketDigest": "sha256:8591ae6e89aa9654ac89d7a59f0eafdc30da0fac11755670faa96d14248925f1",
  "reportDigest": "sha256:6d50da9ace33f09cdf631bdfaa195c9fefa7a9b68c13defec54ce01b8baa4d29",
  "judgmentId": "sha256:ea12a2a911c15117d96cb36ac39d96c11ce962f232d8d0926dc0c8593bff5633"
}
